topic	tweet_id	tweet_url	tweet_text	class_label
COVID-19	1350553604726218752	http://twitter.com/user/status/1350553604726218752	I'm going to gather all these vaccine deaths reports and create a thread within my feed .. #COVID #COVID19 #AntiVaccine #antivaxxers #antivax #vaccines #antimaskers #CovidVaccines #COVIDVaccination #VaccineDeath #VaccineDeaths #Depopulation #Transhumanism #Eugenics @DrMadej 👇	harmful
COVID-19	1369720534859198469	http://twitter.com/user/status/1369720534859198469	Jack is 87. His wife just turned 85 and lives in a group home... which has not been included among the facilities getting state-coordinated COVID-19 vaccines. He can't get much closer than this. https://t.co/RZhyvkMqNy	yes_blame_authorities
COVID-19	1367234970587193349	http://twitter.com/user/status/1367234970587193349	With rampant COVID-19-caused infections, suffering, and deaths in carceral facilities, one no-brainer step is to pair vaccines with comprehensive decarceration measures. Here’s the argument, laid out by me, @_Eric_Reinhart, Paul Farmer, and @s_keshavjee. https://t.co/zTCelyQjJx	harmful
COVID-19	1367657248336588801	http://twitter.com/user/status/1367657248336588801	@rubiconcapital_ @OnCall4ON More like the Vaccine Cult. No safe Corona virus vaccines were produced for MERS, SARS because animal experiments proved they were not safe. Now, without those safeguards, every Covid vaccine is safe and effective. I have not heard how or if the prior hurdles were overcome.	harmful
COVID-19	1366551931452346368	http://twitter.com/user/status/1366551931452346368	Number of Injuries Reported to CDC After COVID Vaccines Climbs by Nearly 4,000 in One Week Between Dec. 14, 2020, and Feb. 18, 2021, 19,907 reports of adverse events were submitted to VAERS, including 1,095 deaths and 3,767 serious injuries' https://t.co/OM8J4nBvK8 https://t.co/rcDTmHe9rT	harmful
COVID-19	1371053325664260096	http://twitter.com/user/status/1371053325664260096	Dino and Yaya Bello agreed on covid 19 and are doing everything possible to harm their people. Dino despite taking the vaccines in Dubai 🤦🏼‍♂️ At this rate, I won’t mind giving Nnamdi Kanu Kogi State now.	yes_blame_authorities
COVID-19	1.37041E+18	http://twitter.com/user/status/1.37041E+18	A small reminder that the WTO led by the USA, UK, EU, etc (the 'developed nations') blocked a temporary waiver of intellectual property rights for vaccines &amp; treatments related to COVID-19, for the *third time* since it was proposed by South Africa and India last year. 😑😑😑	yes_blame_authorities
COVID-19	1370167917908697089	http://twitter.com/user/status/1370167917908697089	Anyone with an inflammatory disease such as rheumatoid arthritis, Parkinson's disease or chronic Lyme and those with acquired immune deficiency/dysfunction from any microbial pathogen, brain trauma or environmental toxin are at high risk of dying from COVID-19 mRNA vaccines	harmful
COVID-19	1370117121900867585	http://twitter.com/user/status/1370117121900867585	@ABCPolitics tr*mp gets credit for lying about covid-19, telling people to inject bleach, killing 500,000 americans, spreading misinformation/disinformation about covid-19, having NO PLAN to deal with the pandemic short of 'sacrifice the olds and the kids,' losing 20,000,000 vaccines, etc	harmful
COVID-19	1368600638490312706	http://twitter.com/user/status/1368600638490312706	A narrative has emerged that all of the COVID-19 vaccines are perfect--or close to it--at preventing hospitalization or death. Here's @hildabast on how that's not quite right, and why the details matter. https://t.co/2d7CW58vSo	yes_discusses_cure
COVID-19	1369709127015018498	http://twitter.com/user/status/1369709127015018498	SERIOUS ! Geert Vanden Bossche, vaccine expert, formerly of GAVI and the B&amp;M Gates Foundation has written an open letter to all scientists: This type of prophylactic [covid] vaccines are.. highly dangerous, when used... during a viral pandemic.. READ: https://t.co/dXpNCoQAzq	harmful
COVID-19	1366794778009034756	http://twitter.com/user/status/1366794778009034756	From someone who dealed with hundreds of cases of the new variant (me): the P.1 variant is the nightmare of a nightmare - more transmissible, more pathogenic, likely more legal, possible less covered by current COVID-19 vaccines, less responsive to corticoids and other therapies.	harmful
COVID-19	1370435166569644033	http://twitter.com/user/status/1370435166569644033	The need for global solidarity is now stronger than ever. Communities across the globe must have equitable access to diagnostic tools, treatments, and vaccines for COVID-19. Governments have invested billions of tax-payer funds into research and developm…https://t.co/pydgY0iRmN	yes_calls_for_action
COVID-19	1370400481684697088	http://twitter.com/user/status/1370400481684697088	Thank Trump for lying, denying Covid, politicizing masks and 530,000 deaths. Thank Pfizer, Moderna and J&amp;J for the vaccines. Thank Biden for vaccine distribution, truth, competence and the American Rescue Plan.	yes_blame_authorities
COVID-19	1370107322220052480	http://twitter.com/user/status/1370107322220052480	It’s very frustrating to me that the people who are required to work in-person are some of the same people at the end of the line for COVID vaccines. We MUST prioritize our essential workforce. Equitable and just vaccine distribution is key to our economic recovery.	yes_calls_for_action
COVID-19	1369879531796885506	http://twitter.com/user/status/1369879531796885506	I’m coming to believe Justin Trudeau is an anti-vaxxer: He did a horrid job getting vaccines for Canadians, he didn’t support vaccine manufacturing, and now he’s trash talking a G-7 plan for vaccine passports. Sounds 100% like an anti-vaxxer. https://t.co/HluyogMcEB	yes_blame_authorities
COVID-19	1369089161051930624	http://twitter.com/user/status/1369089161051930624	IT’S NOT JUST ABOUT VACCINES New coronavirus drug/antibody said to be 80x more potent It should come as no surprise that work is also ongoing behind the scenes toward the development of other effective coronavirus treatments and therapies #MOG https://t.co/g3agrSfdBt	yes_discusses_cure
COVID-19	1368724701867081736	http://twitter.com/user/status/1368724701867081736	The US has found multiple online publications that, under instruction from Russia, are spreading misinformation about the @Pfizer and @Moderna COVID-19 vaccines. | #Russia | #COVID19 | https://t.co/8HMEy4Sk1q	harmful
COVID-19	1367492781954981888	http://twitter.com/user/status/1367492781954981888	The Palestinian org. @AMANCoalition has accused the PA of playing favorites with the Covid vaccine, releasing a poster which simply reads Wasta kills. Wasta is an Arabic term for “nepotism and abuse of power and positions in obtaining vaccines.” https://t.co/KpIcOjlPiS	harmful
COVID-19	1366643779885699073	http://twitter.com/user/status/1366643779885699073	“🇨🇳 The People's Republic of China sends us 500 thousand doses of vaccines against Covid_19. 🇺🇲 The United States sends us terrorists, they penalize us and block us financially...” https://t.co/szBlVf0AHx	harmful
COVID-19	1370746633856684035	http://twitter.com/user/status/1370746633856684035	Sonali Kolhatkar: Pfizer and Moderna have earned near-mythical status for the life-saving vaccines, but... these private entities were paid handsomely to do their job and cannot be allowed to hold humanity hostage over their profits. https://t.co/2FR3yBKfhS #COVID19	harmful
COVID-19	1370377805842821122	http://twitter.com/user/status/1370377805842821122	Journalist Hana Salah talks about Palestinian prisoners smuggling their sperm out of Israeli prisons for IVF treatment in Palestine. We discuss the Covid-19 situation, vaccines inequality, destruction of Irish aid and the plight of Palestinian fishermen https://t.co/jwkey1MkLb https://t.co/vJPlla0dml	harmful
COVID-19	1369986908898533377	http://twitter.com/user/status/1369986908898533377	"Use of Covid-19 ""vaccines"" is NOT EXPERIMENTAL! They are UNTESTED! In an EXPERIMENT you give jabs to some people and NOT give jabs to others to see the DIFFERENCE! IN AN EXPERIMENT YOU DON'T ""VACCINATE"" EVERYBODY! NOT AN EXPERIMENT BUT AN ASSAULT! #auspol #CovidVaccine"	harmful
COVID-19	1369958779240935424	http://twitter.com/user/status/1369958779240935424	The UK, EU and USA are blocking proposals at the @wto to get the vaccine quickly rolled out to the world poorest countries. We need to put peoples lives before profit! That’s why CAFOD are joining the movement for a people’s vaccine 💉 #PeoplesVaccine https://t.co/N1VsrRhW4Y https://t.co/xvVIovSKq7	yes_blame_authorities
COVID-19	1369862941630226432	http://twitter.com/user/status/1369862941630226432	Corrupt Florida. Setting up vaccines for the rich, and DeSantis is under investigation for taking bribes related to vaccines. https://t.co/Bh7mZUwr4v	yes_blame_authorities
COVID-19	1369836915982147593	http://twitter.com/user/status/1369836915982147593	These doctors bring up several big concerns about risks of the SARS-CoV-2 mRNA vaccines. https://t.co/vDCiaGKFqe	harmful
COVID-19	1369715536096092164	http://twitter.com/user/status/1369715536096092164	Read @realtahiramin on how the international intellectual property regime is holding back efforts to produce and distribute COVID-19 vaccines across the developing world—and what wealthy countries should do about it. https://t.co/WdvXowzwYc	yes_blame_authorities
COVID-19	1369435010177044482	http://twitter.com/user/status/1369435010177044482	Just saw on NBC national news that state of South Carolina has a surplus of COVID vaccines. Somebody needs to tell me where these vaccines are-we have been searching for days for a vaccine appointment-everything is booked according to SCDHEC and phone calls to private pharmacies.	yes_asks_question
COVID-19	1369295277589475329	http://twitter.com/user/status/1369295277589475329	Over 20 drug companies have written to Biden to reject a proposal from India and S Africa before the WTO to temporarily waive patents to try to widen access to Covid-19 medicines and vaccines to largely low-income countries. UK, US, EU are already against https://t.co/ITGJHvqMBV	yes_blame_authorities
COVID-19	1370360952005201922	http://twitter.com/user/status/1370360952005201922	The US is holding the rest of the world back and if we don’t act soon the coronavirus will continue to mutate, our vaccines will be less effective and the pandemic will continue to spread across the planet. https://t.co/FKcP2zFQLi	yes_blame_authorities
COVID-19	1369944198888181761	http://twitter.com/user/status/1369944198888181761	All people living in Southern Africa need equitable vaccine access. Time is short and our people are dying, so the regional body should act fast https://t.co/Kv0Yo63tKH	yes_calls_for_action
COVID-19	1369808797015891974	http://twitter.com/user/status/1369808797015891974	"Patents on #covid vaccines are going to kill people: ""the US and a small number of wealthy countries ... blocked a proposal to temporarily waive countries’ obligation to enforce patents on covid-19 vaccines during the pandemic"" https://t.co/uNNx34SHUD"	yes_blame_authorities
COVID-19	1369565744095191041	http://twitter.com/user/status/1369565744095191041	The Government has failed to source extra vaccines from other EU countries or the UK, and has no plans to seek extra supplies from outside the EU https://t.co/mzGkq8ZCJ1 via @IrishTimes	yes_blame_authorities
COVID-19	1368956397052960775	http://twitter.com/user/status/1368956397052960775	👇AND vaccines won't prevent you from spreading the virus or catching it again. 🤔Makes me wonder if we would have herd immunity if there had been no lockdowns CDC: Face Masks Don’t Prevent COVID-19 https://t.co/GMmKjxjTGq	harmful
COVID-19	1368933413177155589	http://twitter.com/user/status/1368933413177155589	VACCINES B4 COVID 10-15 yr development process 6-7 yr clinical tests on 1,000s 2 yr approval process COVID VACCINES 1 yr devel 5-6 mo clinical tests on 1,000s 8 mo Emergency Use Authorization Good luck https://t.co/x949mLglQt https://t.co/4o6v3K3DCJ https://t.co/sz3Fo6QE5h https://t.co/wMB2DWPGxu	harmful
COVID-19	1370998962916716545	http://twitter.com/user/status/1370998962916716545	Such stupidity and this plus that order against couple holding hands represent two things: one, government running out of strategies to contain COVID-19 with vaccines delayed. Two, tendency of gov’t to mess with our constitutionally guaranteed privacy. https://t.co/DTiuog3RC3	yes_blame_authorities
COVID-19	1370963291158155265	http://twitter.com/user/status/1370963291158155265	Dr. Fauci is now an unofficial spokesperson of China’s COVID efforts, achievements and vaccines #DrFauci is making his priorities clear, and yet again he has disappointed many people. https://t.co/GAAXd7yEqn	yes_blame_authorities
COVID-19	1370580073565278211	http://twitter.com/user/status/1370580073565278211	History is dying: Brazil's Indigenous communities urgently need COVID-19 vaccines and protection, groups say. #ThisIsOurShot https://t.co/0oytN6XpNX	yes_calls_for_action
COVID-19	1370462094429089796	http://twitter.com/user/status/1370462094429089796	As of March 5, there have been 1,524 deaths, 1,072 life-threatening adverse events, 630 cases of permanent disability, and 9,000+ hospitalizations and emergency room visits following COVID vaccination reported to the Vaccine Adverse Event Reporting System. #COVID19 #CovidVaccine https://t.co/Td9zV7Mnw0	harmful
COVID-19	1369961085277716480	http://twitter.com/user/status/1369961085277716480	@BreesAnna @Colin_Cambray I wonder when the MSM will question the gov on their own figures for adverse reactions and death resulting from the various covid vaccines . They tell us but the press don’t report it. https://t.co/dSXU3L2xUs	harmful
COVID-19	1369878694060122117	http://twitter.com/user/status/1369878694060122117	When (not if) the next covid outbreak happens in Aust. Every fucking business that has to close down better blame Fed Gov for fucking up the vaccine rollout and not their state premier. #CovidVaccine #WhereFuckingIsIt #scottydoesnothing	yes_blame_authorities
COVID-19	1369702372004528136	http://twitter.com/user/status/1369702372004528136	#FLGov. @RonDeSantisFL is being accused of saving vaccines for wealthy, white, Republican zip codes. These texts expose the political considerations that led to the vaccination event in question: https://t.co/TNSxvpt7Ve	yes_blame_authorities
COVID-19	1368712530735083525	http://twitter.com/user/status/1368712530735083525	@CROWSPLAY1 @haterdeep2 Yep! And apparently... if you have life insurance &amp; die after taking the covid vaccine..... they DO NOT pay out because these “vaccines” are Experimental 🤔🤷🏽‍♀️ https://t.co/3lRg3YA8Rs	harmful
COVID-19	1368272724133548033	http://twitter.com/user/status/1368272724133548033	First #BigPharma takes billions from Taxpayers for vaccine research. Then they demand monopoly control so they can set prices and limit supply. Now they’re making billions more selling the same vaccines back to us that we funded We need a better system! https://t.co/kkyfOneYTu	yes_blame_authorities
COVID-19	1370181568053006336	http://twitter.com/user/status/1370181568053006336	The Democrats' hyper-partisan $1.9 trillion wish list is not focused on coronavirus relief. All told, less than 10% of the Democrats’ wish list is for directly combating COVID-19 and just 1% is for vaccines.	harmful
COVID-19	1370131291551768580	http://twitter.com/user/status/1370131291551768580	🚨🚨VACCINE REGISTRY🚨🚨 YES, there is a governmental records database for who is and isn't vaccinated with CV19💉. They can even contact you to inform you that you haven't gotten the jab yet. VAMS info: https://t.co/NZVsjTuia7 Reporting requirements: https://t.co/e2kAESmHPi https://t.co/1cytEKe93k	harmful
COVID-19	1369757545561219075	http://twitter.com/user/status/1369757545561219075	23 years after Canada proposed bar codes to deliver vaccines quickly/accurately, the country is in an IT dark age and has fallen behind countries like India and Turkey tracking vaccines to protect people from #COVID19 @Justin_Ling @globeandmail https://t.co/Ljr4JQnO9l	yes_blame_authorities
COVID-19	1369728514182717440	http://twitter.com/user/status/1369728514182717440	Let me be very clear about how I believe that wearing a mask is better than taking the COVID Vaccine. First off, vaccines AREN'T full-prooff, and with these new COVID variants, we have NO IDEA how effective ALL COVID VACCINES are against the new strains at all.	harmful
COVID-19	1369473325534167042	http://twitter.com/user/status/1369473325534167042	CDC: 1,265 DEAD and 25,212 Injuries Following Experimental COVID-19 mRNA 'Vaccines' https://t.co/ZbzWrBAuV9	harmful
COVID-19	1369429720903933953	http://twitter.com/user/status/1369429720903933953	Pfizer is demanding countries put up sovereign assets as collateral for expected vaccine injury lawsuits resulting from its COVID-19 inoculation. It wants governments to guarantee the company will be compensated for any expenses. https://t.co/OGPzXGVozx	harmful
COVID-19	1369361833166073858	http://twitter.com/user/status/1369361833166073858	Pfizer's and Moderna's vaccine was found to have a reduced effectiveness against the South African variant by about 10.3 and 12.4 times respectively. Both Novavax and Johnson &amp; Johnson vaccines showed a substantial drop in efficacy in South Africa https://t.co/jxHH0sm5z2	yes_discusses_cure
COVID-19	1369072484545396740	http://twitter.com/user/status/1369072484545396740	It’s CRAZY to me how this government was so quick to attribute every death to Covid when a person diagnosed has died but ☝🏾 when it comes to the vaccine and deaths they’re quick to state “No link found between vaccines &amp; deaths. The jig is up already.	yes_blame_authorities
COVID-19	1368743198017921024	http://twitter.com/user/status/1368743198017921024	ICYMI: Iowa reported another 86 kids have contracted coronavirus, pushing the total to 3,868 in 37 days since January 29, the day Gov. Reynolds signed SF160 to force schools to provide 100% in-person learning without requiring safety precautions. (1/2) https://t.co/PI1964xDQE	yes_blame_authorities
COVID-19	1368268839872528384	http://twitter.com/user/status/1368268839872528384	Vaccines go overwhelmingly to rich countries and privileged racial groups within them. Granting special rights for the vaccinated, while tightening restrictions on the unvaccinated, risks widening already-dangerous social gaps. https://t.co/GRLUqKf8b2	yes_blame_authorities
COVID-19	1370245453925785601	http://twitter.com/user/status/1370245453925785601	Expect more deaths from the CV-19 vaccines. It normally takes years to develop a vaccine, and this was rushed through for a virus that has a survival rate of more than 99%. Big Brother and Big Pharma SCAM. “The Great Reset.” https://t.co/D13LeDuhDF via @nypost	harmful
COVID-19	1370167702329946112	http://twitter.com/user/status/1370167702329946112	Denmark, Norway and Iceland suspend use of AstraZeneca Covid vaccine over reports of blood clots https://t.co/RAqwJjzJWW #COVID19 #CovidVaccine #AstraZeneca	yes_discusses_cure
COVID-19	1370022366110187525	http://twitter.com/user/status/1370022366110187525	From the beginning we argued that immunity passports were scientifically unsound and ethically perilous. With Covid-19 vaccines now in the arms of some but not others, it’s as if everything and nothing has changed. https://t.co/hqs1KvSzcF	yes_blame_authorities
COVID-19	1369818885873147905	http://twitter.com/user/status/1369818885873147905	@Boschii @BillKristol If not for trump ignoring his PDBs circa Christmas 2019, we never even would've had a NEED for vaccines, because COVID-19 would've been squashed very early on like SARS and MERS before it. 🙄	yes_blame_authorities
COVID-19	1369626753937911811	http://twitter.com/user/status/1369626753937911811	We’re facing one pandemic with two futures: one for wealthy countries that can afford and acquire vaccines, and another for low-income countries that cannot. @PoliticsReid provides a good look at the global vaccine landscape. https://t.co/XPRLPSmjwd	yes_blame_authorities
COVID-19	1369615418692956161	http://twitter.com/user/status/1369615418692956161	Business people, economists, academics and trade unionists calling on the prime minister to support the proposal by 100 low and middle income countries to suspend patents on Covid-19 vaccines #PeoplesVaccine @BorisJohnson https://t.co/17uWvtTK1i	yes_blame_authorities
COVID-19	1369557132576583685	http://twitter.com/user/status/1369557132576583685	Programming: V@x will help with gun crime in Florida, Indiana, Pennsylvania, Ohio, New Mexico, New Jersey etc With COVID-19 cases falling and vaccines rolling out, some criminologists hope a rebounding economy and reopened schools will drive down the national numbers in 2021 https://t.co/uKURKWur44	harmful
COVID-19	1369555738696118275	http://twitter.com/user/status/1369555738696118275	The World Trade Organization and Doctors Without Borders call for @ScottMorrisonMP to stop obstructing the Intellectual Property waver and #COVID19 medical products. Saying it is preventing poorer countries having access to vaccines and treatments #auspol https://t.co/6Mw75NdPwy	yes_blame_authorities
COVID-19	1369488602023956481	http://twitter.com/user/status/1369488602023956481	we have 1.3 million vaccine doses, but only 100k have been given. Some states are lagging badly and now not sharing data QLD only gave 22% of doses they got last week, VIC just 30%. Latest federal stats only show vaccines given, not number delivered https://t.co/30k5PbKBl3 https://t.co/oUDQ5DAkmb	yes_blame_authorities
COVID-19	1369435335474741263	http://twitter.com/user/status/1369435335474741263	The world won't recover from COVID-19 if some populations are excluded from access to vaccines and other much needed aid. Tell Congress: Israel must provide Palestinians living under occupation with medical needs and vaccines. https://t.co/n1YC05Sq2V	yes_blame_authorities
COVID-19	1369372354300755972	http://twitter.com/user/status/1369372354300755972	Latino churches have become a double-edged sword on Covid-19 vaccines. While some are taking the lead to provide correct Covid-19 info and boost vaccinations, others have spread disinformation, worrying officials. By @c_sesin https://t.co/oVI9APQ3aP	harmful
COVID-19	1369366640048144392	http://twitter.com/user/status/1369366640048144392	⚠️ Over 75% of #Covid19 vaccinations carried out in just 10 countries ‼️ Vaccine monopolies are creating artificial scarcity. We urge members of the @wto to support the #TRIPSwaiver proposal and help boost global vaccine production. Our statement ➡️ https://t.co/JYr7MMbSzR ⬅️ https://t.co/Cm5G8k4yJ7	yes_blame_authorities
COVID-19	1368752710745423873	http://twitter.com/user/status/1368752710745423873	@WSJ You should replace this headline with - American doctors &amp; scientists have mounted an information campaign to warn people of the dangers of the Covid-19 vaccines which only have 'Emergency Use' authorization and HAVE NOT been approved by the FDA. Informed Consent must be present	yes_blame_authorities
COVID-19	1368734247557664768	http://twitter.com/user/status/1368734247557664768	@davidkurten Neither will I - not unless all the guinea pigs I know are still alive and well in 3 - 5 years time. How COVID-19 ‘Vaccines’ May Destroy the Lives of Millions - Judy Mikovits | Dr. Mercola https://t.co/Cnu6AOZGRE	harmful
COVID-19	1368652454041161739	http://twitter.com/user/status/1368652454041161739	Russian disinformation campaign aims to undermine confidence in Pfizer, other Covid-19 vaccines, U.S. officials say https://t.co/AfF7ImTWLP played up the risk of side effects, questioned their efficacy, and said the U.S. had rushed the Pfizer vaccine through the approval process	harmful
COVID-19	1368288035402579971	http://twitter.com/user/status/1368288035402579971	😡😡😡 Deaths and serious injuries from the Covid vaccines continue to grow. Latest CDC VAERS report shows 1,265 deaths and 4,424 serious injuries. 47% of reported deaths became sick within 48 hours of being jabbed https://t.co/6CQTG9QXSm #CovidVaccine https://t.co/yWUrQ0OZHl	harmful
COVID-19	1367744561531949057	http://twitter.com/user/status/1367744561531949057	COVID-19 antibody-based drugs and vaccines developed so far may become less effective as new variants of the novel coronavirus spread widely, according to a new study https://t.co/tYeDQ2gIwS	yes_discusses_cure
COVID-19	1370737161553784836	http://twitter.com/user/status/1370737161553784836	Like so much of the government response to COVID-19, the rollout of vaccines has been beset by poor planning and bad management. https://t.co/0XBsFB5UZO	yes_blame_authorities
COVID-19	1370438735473606662	http://twitter.com/user/status/1370438735473606662	UK, US, and EU blocked a push by India and South Africa at WTO to waive patent rights in an effort to boost production of COVID-19 vaccines for poor nations. The notion was supported by 80 developing countries, but opposed by all Western countries. https://t.co/Sq6nDwjwFE	yes_blame_authorities
COVID-19	1370281114628149250	http://twitter.com/user/status/1370281114628149250	They told you vaccines were 100% safe and 95% effective. They lied. The EMA covid-19 data leak, and what it tells us about mRNA instability https://t.co/m0LURlgOke	harmful
COVID-19	1370132844262096897	http://twitter.com/user/status/1370132844262096897	This --&gt; It’s very obvious that distribution of vaccines favors wealthier, whiter Marylanders, and Hogan doubling down on his dismissal of an easily identifiable fact is a dangerous failure of leadership. https://t.co/uUJF6Fwe8Y	yes_blame_authorities
